{
  "status": "VALID_OUTPUT",
  "pack_type": "profile",
  "deliverable_created": {
    "summary": "Complete reusable LF profile pack",
    "required_directories": ["contracts", "schemas", "judges", "checklists", "examples", "fixtures", "validators", "evals", "handoffs", "adapters"],
    "quality_gate": "READY_FOR_QUALITY_PACK"
  },
  "evidence_map": ["SKILL.md", "schemas/output.schema.json", "validators/validate_pack.py"],
  "blocking_codes": [],
  "next_gate": "QUALITY_PACK_REVIEW"
}
